{
  "request_id": "req-demo-001",
  "project_id": "project-demo",
  "task_id": null,
  "scene_code": "lifting_supervision",
  "question": "本次旁站有哪些历史案例可以参考？",
  "context": {
    "object_type": "lifting",
    "stage": "preparation",
    "conditions": {}
  },
  "output_types": [
    "answer",
    "cases"
  ],
  "limit": 5
}
